C1: Форма № 4.1 риур
B2: СВЕДЕНИЯ
B3: о численности избирателей, участников референдума,
B4: зарегистрированных на территории города Москвы
B5: по состоянию на 1 января 2009 года
A7: № п/п | B7: Наименование административно-территориальной единицы | C7: Число избирателей, участников референдума по административно-территориальной единице
B8: Центральный административный округ
A9: 1 | B9: район Арбат | C9: 16603
A10: 2 | B10: Басманный район | C10: 61553
A11: 3 | B11: район Замоскворечье | C11: 29145
A12: 4 | B12: Красносельский район | C12: 24925
A13: 5 | B13: Мещанский район | C13: 34444
A14: 6 | B14: Пресненский район | C14: 80236
A15: 7 | B15: Таганский район | C15: 74608
A16: 8 | B16: Тверской район | C16: 48624
A17: 9 | B17: район Хамовники | C17: 56889
A18: 10 | B18: район Якиманка | C18: 13498
B19: Итого по Центральному административному округу | C19: =SUM(C9:C18) -> 440525
B20: Северный административный округ
A21: 11 | B21: район Аэропорт | C21: 45198
A22: 12 | B22: район Беговой | C22: 24841
A23: 13 | B23: Бескудниковский район | C23: 50491
A24: 14 | B24: Войковский район | C24: 43591
A25: 15 | B25: район Восточное Дегунино | C25: 60446
A26: 16 | B26: Головинский район | C26: 66420
A27: 17 | B27: Дмитровский район | C27: 55193
A28: 18 | B28: район Западное Дегунино | C28: 52546
A29: 19 | B29: район Коптево | C29: 60780
A30: 20 | B30: Левобережный район | C30: 30668
A31: 21 | B31: Молжаниновский район | C31: 2021
A32: 22 | B32: Савеловский район | C32: 37931
A33: 23 | B33: район Сокол | C33: 31847
A34: 24 | B34: Тимирязевский район | C34: 51329
A35: 25 | B35: район Ховрино | C35: 56991
A36: 26 | B36: Хорошевский район | C36: 40461
B37: Итого по Северному административному округу | C37: =SUM(C21:C36) -> 710754
B38: Северо-Восточный административный округ
A39: 27 | B39: Алексеевский район | C39: 41884
A40: 28 | B40: Алтуфьевский район | C40: 34658
A41: 29 | B41: Бабушкинский район | C41: 60452
A42: 30 | B42: район Бибирево | C42: 105828
A43: 31 | B43: Бутырский район | C43: 40343
A44: 32 | B44: район Лианозово | C44: 55173
A45: 33 | B45: Лосиноостровский район | C45: 57052
A46: 34 | B46: район Марфино | C46: 16208
A47: 35 | B47: район Марьина роща | C47: 37770
A48: 36 | B48: Останкинский район | C48: 37128
A49: 37 | B49: район Отрадное | C49: 123520
A50: 38 | B50: район Ростокино | C50: 22569
A51: 39 | B51: район Свиблово | C51: 34558
A52: 40 | B52: район Северное Медведково | C52: 73632
A53: 41 | B53: район Северный | C53: 9305
A54: 42 | B54: район Южное Медведково | C54: 50923
A55: 43 | B55: Ярославский район | C55: 54516
B56: Итого по Северо-Восточному административному округу | C56: =SUM(C39:C55) -> 855519
B57: Восточный административный округ
A58: 44 | B58: район Богородское | C58: 61673
A59: 45 | B59: район Вешняки | C59: 78976
A60: 46 | B60: район Восточное Измайлово | C60: 42829
A61: 47 | B61: район Восточный | C61: 7680
A62: 48 | B62: район Гольяново | C62: 107066
A63: 49 | B63: район Ивановское | C63: 80131
A64: 50 | B64: район Измайлово | C64: 63100
A65: 51 | B65: район Косино-Ухтомский | C65: 28413
A66: 52 | B66: район Метрогородок | C66: 22671
A67: 53 | B67: район Новогиреево | C67: 54477
A68: 54 | B68: район Новокосино | C68: 62533
A69: 55 | B69: район Перово | C69: 80717
A70: 56 | B70: район Преображенское | C70: 50788
A71: 57 | B71: район Северное Измайлово | C71: 57252
A72: 58 | B72: район Соколиная гора | C72: 52785
A73: 59 | B73: район Сокольники | C73: 35201
B74: Итого по Восточному административному округу | C74: =SUM(C58:C73) -> 886292
B75: Юго-Восточный административный округ
A76: 60 | B76: район Выхино-Жулебино | C76: 131071
A77: 61 | B77: район Капотня | C77: 17540
A78: 62 | B78: район Кузьминки | C78: 82447
A79: 63 | B79: район Лефортово | C79: 52139
A80: 64 | B80: район Люблино | C80: 107925
A81: 65 | B81: район Марьино | C81: 161983
A82: 66 | B82: район Некрасовка | C82: 6924
A83: 67 | B83: Нижегородский район | C83: 25246
A84: 68 | B84: район Печатники | C84: 54075
A85: 69 | B85: Рязанский район | C85: 57251
A86: 70 | B86: район Текстильщики | C86: 60330
A87: 71 | B87: Южнопортовый район | C87: 42829
B88: Итого по Юго-Восточному административному округу | C88: =SUM(C76:C87) -> 799760
B89: Южный административный округ
A90: 72 | B90: район Бирюлево Восточное | C90: 87804
A91: 73 | B91: район Бирюлево Западное | C91: 52391
A92: 74 | B92: район Братеево | C92: 63932
A93: 75 | B93: Даниловский район | C93: 59034
A94: 76 | B94: Донской район | C94: 28572
A95: 77 | B95: район Зябликово | C95: 78184
A96: 78 | B96: район Москворечье-Сабурово | C96: 45625
A97: 79 | B97: район Нагатино-Садовники | C97: 45153
A98: 80 | B98: район Нагатинский затон | C98: 68684
A99: 81 | B99: Нагорный район | C99: 46093
A100: 82 | B100: район Орехово-Борисово Северное | C100: 76814
A101: 83 | B101: район Орехово-Борисово Южное | C101: 90942
A102: 84 | B102: район Царицыно | C102: 75225
A103: 85 | B103: район Чертаново Северное | C103: 66277
A104: 86 | B104: район Чертаново Центральное | C104: 69027
A105: 87 | B105: район Чертаново Южное | C105: 89926
B106: Итого по Южному административному округу | C106: =SUM(C90:C105) -> 1043683
B107: Юго-Западный административный округ
A108: 88 | B108: Академический район | C108: 61739
A109: 89 | B109: Гагаринский район | C109: 49008
A110: 90 | B110: район Зюзино | C110: 71231
A111: 91 | B111: район Коньково | C111: 98760
A112: 92 | B112: район Котловка | C112: 40249
A113: 93 | B113: Ломоносовский район | C113: 52681
A114: 94 | B114: Обручевский район | C114: 41328
A115: 95 | B115: район Северное Бутово | C115: 57292
A116: 96 | B116: район Теплый Стан | C116: 83677
A117: 97 | B117: район Черемушки | C117: 62694
A118: 98 | B118: район Южное Бутово | C118: 107154
A119: 99 | B119: район Ясенево | C119: 120830
B120: Итого по Юго-Западному административному округу | C120: =SUM(C108:C119) -> 846643
B121: Западный административный округ
A122: 100 | B122: район Внуково | C122: 13969
A123: 101 | B123: район Дорогомилово | C123: 37867
A124: 102 | B124: район Крылатское | C124: 55755
A125: 103 | B125: район Кунцево | C125: 90686
A126: 104 | B126: Можайский район | C126: 86038
A127: 105 | B127: район Ново-Переделкино | C127: 70339
A128: 106 | B128: район Очаково-Матвеевское | C128: 65002
A129: 107 | B129: район Проспект Вернадского | C129: 36422
A130: 108 | B130: район Раменки | C130: 72534
A131: 109 | B131: район Солнцево | C131: 64193
A132: 110 | B132: район Тропарево-Никулино | C132: 67035
A133: 111 | B133: район Филевский парк | C133: 47641
A134: 112 | B134: район Фили-Давыдково | C134: 65584
B135: Итого по Западному административному округу | C135: =SUM(C122:C134) -> 773065
B136: Северо-Западный административный округ
A137: 113 | B137: район Куркино | C137: 10692
A138: 114 | B138: район Митино | C138: 109070
A139: 115 | B139: район Покровское-Стрешнево | C139: 33723
A140: 116 | B140: район Северное Тушино | C140: 94543
A141: 117 | B141: район Строгино | C141: 91303
A142: 118 | B142: район Хорошево - Мневники | C142: 98197
A143: 119 | B143: район Щукино | C143: 65204
A144: 120 | B144: район Южное Тушино | C144: 65563
B145: Итого по Северо-Западному административному округу | C145: =SUM(C137:C144) -> 568295
B146: Зеленоградский административный округ
A147: 121 | B147: район Матушкино-Савелки | C147: 54172
A148: 122 | B148: Панфиловский район | C148: 54112
A149: 123 | B149: район Крюково | C149: 61388
B150: Итого по Зеленоградскому административному округу | C150: =SUM(C147:C149) -> 169672
B151: Всего избирателей по городу Москве | C151: =SUM(C9:C150)/2 -> 7094208
B153: Мэр Москвы | C153: Ю.М. Лужков
B155: Председатель Московской городской избирательной комиссии | C155: В.П. Горбунов