C1: Close Help

A2: 4 captures 15 Feb 08 - 6 Jun 08

A1: Jan | B1: FEB | C1: MAR
B2: 15
A3: 2007 | B3: 2008 | C3: 2009

E1: Форма № 4.1 риур
D2: СВЕДЕНИЯ
D3: о численности избирателей, участников референдума,
D4: зарегистрированных на территории города Москвы
D5: по состоянию на 1 января 2008 года
C7: № п/п | D7: Наименование административно-территориальной единицы | E7: Число избирателей, участников референдума по административно-территориальной единице
D8: Центральный административный округ
C9: 1 | D9: район Арбат | E9: 16692
C10: 2 | D10: Басманный район | E10: 60798
C11: 3 | D11: район Замоскворечье | E11: 28806
C12: 4 | D12: Красносельский район | E12: 24760
C13: 5 | D13: Мещанский район | E13: 34315
C14: 6 | D14: Пресненский район | E14: 79366
C15: 7 | D15: Таганский район | E15: 74493
C16: 8 | D16: Тверской район | E16: 48138
C17: 9 | D17: район Хамовники | E17: 55295
C18: 10 | D18: район Якиманка | E18: 13478
D19: Итого по Центральному административному округу | E19: =SUM(E9:E18) -> 436141
D20: Северный административный округ
C21: 11 | D21: район Аэропорт | E21: 46003
C22: 12 | D22: район Беговой | E22: 25075
C23: 13 | D23: Бескудниковский район | E23: 50413
C24: 14 | D24: Войковский район | E24: 43619
C25: 15 | D25: район Восточное Дегунино | E25: 60699
C26: 16 | D26: Головинский район | E26: 67003
C27: 17 | D27: Дмитровский район | E27: 55475
C28: 18 | D28: район Западное Дегунино | E28: 52316
C29: 19 | D29: район Коптево | E29: 60544
C30: 20 | D30: Левобережный район | E30: 31142
C31: 21 | D31: Молжаниновский район | E31: 2013
C32: 22 | D32: Савеловский район | E32: 38149
C33: 23 | D33: район Сокол | E33: 32034
C34: 24 | D34: Тимирязевский район | E34: 51408
C35: 25 | D35: район Ховрино | E35: 56682
C36: 26 | D36: Хорошевский район | E36: 39307
D37: Итого по Северному административному округу | E37: =SUM(E21:E36) -> 711882
D38: Северо-Восточный административный округ
C39: 27 | D39: Алексеевский район | E39: 42161
C40: 28 | D40: Алтуфьевский район | E40: 34467
C41: 29 | D41: Бабушкинский район | E41: 60557
C42: 30 | D42: район Бибирево | E42: 105745
C43: 31 | D43: Бутырский район | E43: 40166
C44: 32 | D44: район Лианозово | E44: 54522
C45: 33 | D45: Лосиноостровский район | E45: 57054
C46: 34 | D46: район Марфино | E46: 15917
C47: 35 | D47: район Марьина роща | E47: 37737
C48: 36 | D48: Останкинский район | E48: 37023
C49: 37 | D49: район Отрадное | E49: 123876
C50: 38 | D50: район Ростокино | E50: 22579
C51: 39 | D51: район Свиблово | E51: 34393
C52: 40 | D52: район Северное Медведково | E52: 73425
C53: 41 | D53: район Северный | E53: 7255
C54: 42 | D54: район Южное Медведково | E54: 50689
C55: 43 | D55: Ярославский район | E55: 55051
D56: Итого по Северо-Восточному административному округу | E56: =SUM(E39:E55) -> 852617
D57: Восточный административный округ
C58: 44 | D58: район Богородское | E58: 57394
C59: 45 | D59: район Вешняки | E59: 80229
C60: 46 | D60: район Восточное Измайлово | E60: 43069
C61: 47 | D61: район Восточный | E61: 7675
C62: 48 | D62: район Гольяново | E62: 108047
C63: 49 | D63: район Ивановское | E63: 81633
C64: 50 | D64: район Измайлово | E64: 63286
C65: 51 | D65: район Косино-Ухтомский | E65: 22497
C66: 52 | D66: район Метрогородок | E66: 22686
C67: 53 | D67: район Новогиреево | E67: 56425
C68: 54 | D68: район Новокосино | E68: 61448
C69: 55 | D69: район Перово | E69: 81761
C70: 56 | D70: район Преображенское | E70: 50971
C71: 57 | D71: район Северное Измайлово | E71: 57421
C72: 58 | D72: район Соколиная гора | E72: 52535
C73: 59 | D73: район Сокольники | E73: 35111
D74: Итого по Восточному административному округу | E74: =SUM(E58:E73) -> 882188
D75: Юго-Восточный административный округ
C76: 60 | D76: район Выхино-Жулебино | E76: 130145
C77: 61 | D77: район Капотня | E77: 17684
C78: 62 | D78: район Кузьминки | E78: 80640
C79: 63 | D79: район Лефортово | E79: 51685
C80: 64 | D80: район Люблино | E80: 105411
C81: 65 | D81: район Марьино | E81: 157818
C82: 66 | D82: Нижегородский район | E82: 25028
C83: 67 | D83: район Некрасовка | E83: 6542
C84: 68 | D84: район Печатники | E84: 53600
C85: 69 | D85: Рязанский район | E85: 56022
C86: 70 | D86: район Текстильщики | E86: 60335
C87: 71 | D87: Южнопортовый район | E87: 41788
D88: Итого по Юго-Восточному административному округу | E88: =SUM(E76:E87) -> 786698
D89: Южный административный округ
C90: 72 | D90: район Бирюлево Восточное | E90: 87584
C91: 73 | D91: район Бирюлево Западное | E91: 52153
C92: 74 | D92: район Братеево | E92: 63225
C93: 75 | D93: Даниловский район | E93: 55599
C94: 76 | D94: Донской район | E94: 28385
C95: 77 | D95: район Зябликово | E95: 78271
C96: 78 | D96: район Москворечье-Сабурово | E96: 44838
C97: 79 | D97: район Нагатино-Садовники | E97: 44983
C98: 80 | D98: район Нагатинский затон | E98: 68527
C99: 81 | D99: Нагорный район | E99: 45779
C100: 82 | D100: район Орехово-Борисово Северное | E100: 76735
C101: 83 | D101: район Орехово-Борисово Южное | E101: 90697
C102: 84 | D102: район Царицыно | E102: 75345
C103: 85 | D103: район Чертаново Северное | E103: 66614
C104: 86 | D104: район Чертаново Центральное | E104: 68951
C105: 87 | D105: район Чертаново Южное | E105: 91816
D106: Итого по Южному административному округу | E106: =SUM(E90:E105) -> 1039502
D107: Юго-Западный административный округ
C108: 88 | D108: Академический район | E108: 61726
C109: 89 | D109: Гагаринский район | E109: 49347
C110: 90 | D110: район Зюзино | E110: 71169
C111: 91 | D111: район Коньково | E111: 98316
C112: 92 | D112: район Котловка | E112: 40015
C113: 93 | D113: Ломоносовский район | E113: 52968
C114: 94 | D114: Обручевский район | E114: 40082
C115: 95 | D115: район Северное Бутово | E115: 55720
C116: 96 | D116: район Теплый Стан | E116: 83199
C117: 97 | D117: район Черемушки | E117: 62350
C118: 98 | D118: район Южное Бутово | E118: 100801
C119: 99 | D119: район Ясенево | E119: 120639
D120: Итого по Юго-Западному административному округу | E120: =SUM(E108:E119) -> 836332
D121: Западный административный округ
C122: 100 | D122: район Внуково | E122: 13861
C123: 101 | D123: район Дорогомилово | E123: 38381
C124: 102 | D124: район Крылатское | E124: 55673
C125: 103 | D125: район Кунцево | E125: 90156
C126: 104 | D126: Можайский район | E126: 85203
C127: 105 | D127: район Ново-Переделкино | E127: 69673
C128: 106 | D128: район Очаково-Матвеевское | E128: 62890
C129: 107 | D129: район Проспект Вернадского | E129: 36496
C130: 108 | D130: район Раменки | E130: 71984
C131: 109 | D131: район Солнцево | E131: 62750
C132: 110 | D132: район Тропарево-Никулино | E132: 65850
C133: 111 | D133: район Филевский парк | E133: 47708
C134: 112 | D134: район Фили-Давыдково | E134: 65132
D135: Итого по Западному административному округу | E135: =SUM(E122:E134) -> 765757
D136: Северо-Западный административный округ
C137: 113 | D137: район Куркино | E137: 8452
C138: 114 | D138: район Митино | E138: 106200
C139: 115 | D139: район Покровское-Стрешнево | E139: 33800
C140: 116 | D140: район Северное Тушино | E140: 93950
C141: 117 | D141: район Строгино | E141: 91808
C142: 118 | D142: район Хорошево - Мневники | E142: 98393
C143: 119 | D143: район Щукино | E143: 65495
C144: 120 | D144: район Южное Тушино | E144: 64683
D145: Итого по Северо-Западному административному округу | E145: =SUM(E137:E144) -> 562781
D146: Зеленоградский административный округ
C147: 121 | D147: район Матушкино-Савелки | E147: 56275
C148: 122 | D148: Панфиловский район | E148: 53953
C149: 123 | D149: район Крюково | E149: 59407
D150: Итого по Зеленоградскому административному округу | E150: =SUM(E147:E149) -> 169635
D151: Всего избирателей по городу Москве | E151: =SUM(E9:E150)/2 -> 7043533
D153: Заместитель Мэра Москвы в Правительстве Москвы | E153: А.В. Петров
D155: Председатель Московской городской избирательной комиссии | E155: В.П. Горбунов